<?xml version="1.0" encoding="UTF-8"?>
<!DOCTYPE topology SYSTEM "hwloc.dtd">
<topology>
  <object type="System" os_level="-1" os_index="0">
    <object type="Group" os_level="-1" depth="0">
      <object type="Machine" os_level="-1" os_index="0" cpuset="0x00000003" complete_cpuset="0x00000003" online_cpuset="0x00000003" allowed_cpuset="0x00000003" dmi_board_vendor="Dell Inc." dmi_board_name="0F331C" local_memory="1016368">
        <page_type size="4096" count="65536"/>
        <page_type size="1048576" count="1024"/>
        <object type="Socket" os_level="-1" os_index="0" cpuset="0x00000003" complete_cpuset="0x00000003" online_cpuset="0x00000003" allowed_cpuset="0x00000003">
          <object type="Cache" os_level="-1" cpuset="0x00000003" complete_cpuset="0x00000003" online_cpuset="0x00000003" allowed_cpuset="0x00000003" cache_size="2097152" depth="2">
            <object type="Cache" os_level="-1" cpuset="0x00000001" complete_cpuset="0x00000001" online_cpuset="0x00000001" allowed_cpuset="0x00000001" cache_size="32768" depth="1">
              <object type="Core" os_level="-1" os_index="0" cpuset="0x00000001" complete_cpuset="0x00000001" online_cpuset="0x00000001" allowed_cpuset="0x00000001">
                <object type="PU" os_level="-1" os_index="0" cpuset="0x00000001" complete_cpuset="0x00000001" online_cpuset="0x00000001" allowed_cpuset="0x00000001"/>
              </object>
            </object>
            <object type="Cache" os_level="-1" cpuset="0x00000002" complete_cpuset="0x00000002" online_cpuset="0x00000002" allowed_cpuset="0x00000002" cache_size="32768" depth="1">
              <object type="Core" os_level="-1" os_index="1" cpuset="0x00000002" complete_cpuset="0x00000002" online_cpuset="0x00000002" allowed_cpuset="0x00000002">
                <object type="PU" os_level="-1" os_index="1" cpuset="0x00000002" complete_cpuset="0x00000002" online_cpuset="0x00000002" allowed_cpuset="0x00000002"/>
              </object>
            </object>
          </object>
        </object>
      </object>
      <object type="Machine" os_level="-1" os_index="0" cpuset="0x00000003" complete_cpuset="0x00000003" online_cpuset="0x00000003" allowed_cpuset="0x00000003" dmi_board_vendor="Dell Inc." dmi_board_name="0F331C" local_memory="1016368">
        <page_type size="8192" count="1048576"/>
        <object type="Socket" os_level="-1" os_index="0" cpuset="0x00000003" complete_cpuset="0x00000003" online_cpuset="0x00000003" allowed_cpuset="0x00000003">
          <object type="Cache" os_level="-1" cpuset="0x00000003" complete_cpuset="0x00000003" online_cpuset="0x00000003" allowed_cpuset="0x00000003" cache_size="2097152" depth="2">
            <object type="Cache" os_level="-1" cpuset="0x00000001" complete_cpuset="0x00000001" online_cpuset="0x00000001" allowed_cpuset="0x00000001" cache_size="32768" depth="1">
              <object type="Core" os_level="-1" os_index="0" cpuset="0x00000001" complete_cpuset="0x00000001" online_cpuset="0x00000001" allowed_cpuset="0x00000001">
                <object type="PU" os_level="-1" os_index="0" cpuset="0x00000001" complete_cpuset="0x00000001" online_cpuset="0x00000001" allowed_cpuset="0x00000001"/>
              </object>
            </object>
            <object type="Cache" os_level="-1" cpuset="0x00000002" complete_cpuset="0x00000002" online_cpuset="0x00000002" allowed_cpuset="0x00000002" cache_size="32768" depth="1">
              <object type="Core" os_level="-1" os_index="1" cpuset="0x00000002" complete_cpuset="0x00000002" online_cpuset="0x00000002" allowed_cpuset="0x00000002">
                <object type="PU" os_level="-1" os_index="1" cpuset="0x00000002" complete_cpuset="0x00000002" online_cpuset="0x00000002" allowed_cpuset="0x00000002"/>
              </object>
            </object>
          </object>
        </object>
      </object>
    </object>
    <object type="Group" os_level="-1" depth="0">
      <object type="Machine" os_level="-1" os_index="0" cpuset="0x00000003" complete_cpuset="0x00000003" online_cpuset="0x00000003" allowed_cpuset="0x00000003" dmi_board_vendor="Dell Inc." dmi_board_name="0F331C" local_memory="1016368">
        <page_type size="2048" count="0"/>
        <object type="Socket" os_level="-1" os_index="0" cpuset="0x00000003" complete_cpuset="0x00000003" online_cpuset="0x00000003" allowed_cpuset="0x00000003">
          <object type="Cache" os_level="-1" cpuset="0x00000003" complete_cpuset="0x00000003" online_cpuset="0x00000003" allowed_cpuset="0x00000003" cache_size="2097152" depth="2">
            <object type="Cache" os_level="-1" cpuset="0x00000001" complete_cpuset="0x00000001" online_cpuset="0x00000001" allowed_cpuset="0x00000001" cache_size="32768" depth="1">
              <object type="Core" os_level="-1" os_index="0" cpuset="0x00000001" complete_cpuset="0x00000001" online_cpuset="0x00000001" allowed_cpuset="0x00000001">
                <object type="PU" os_level="-1" os_index="0" cpuset="0x00000001" complete_cpuset="0x00000001" online_cpuset="0x00000001" allowed_cpuset="0x00000001"/>
              </object>
            </object>
            <object type="Cache" os_level="-1" cpuset="0x00000002" complete_cpuset="0x00000002" online_cpuset="0x00000002" allowed_cpuset="0x00000002" cache_size="32768" depth="1">
              <object type="Core" os_level="-1" os_index="1" cpuset="0x00000002" complete_cpuset="0x00000002" online_cpuset="0x00000002" allowed_cpuset="0x00000002">
                <object type="PU" os_level="-1" os_index="1" cpuset="0x00000002" complete_cpuset="0x00000002" online_cpuset="0x00000002" allowed_cpuset="0x00000002"/>
              </object>
            </object>
          </object>
        </object>
      </object>
      <object type="Machine" os_level="-1" os_index="0" cpuset="0x00000003" complete_cpuset="0x00000003" online_cpuset="0x00000003" allowed_cpuset="0x00000003" dmi_board_vendor="Dell Inc." dmi_board_name="0F331C" local_memory="1016368">
        <page_type size="2048" count="0"/>
        <page_type size="4096" count="65536"/>
        <page_type size="1048576" count="2048"/>
        <object type="Socket" os_level="-1" os_index="0" cpuset="0x00000003" complete_cpuset="0x00000003" online_cpuset="0x00000003" allowed_cpuset="0x00000003">
          <object type="Cache" os_level="-1" cpuset="0x00000003" complete_cpuset="0x00000003" online_cpuset="0x00000003" allowed_cpuset="0x00000003" cache_size="2097152" depth="2">
            <object type="Cache" os_level="-1" cpuset="0x00000001" complete_cpuset="0x00000001" online_cpuset="0x00000001" allowed_cpuset="0x00000001" cache_size="32768" depth="1">
              <object type="Core" os_level="-1" os_index="0" cpuset="0x00000001" complete_cpuset="0x00000001" online_cpuset="0x00000001" allowed_cpuset="0x00000001">
                <object type="PU" os_level="-1" os_index="0" cpuset="0x00000001" complete_cpuset="0x00000001" online_cpuset="0x00000001" allowed_cpuset="0x00000001"/>
              </object>
            </object>
            <object type="Cache" os_level="-1" cpuset="0x00000002" complete_cpuset="0x00000002" online_cpuset="0x00000002" allowed_cpuset="0x00000002" cache_size="32768" depth="1">
              <object type="Core" os_level="-1" os_index="1" cpuset="0x00000002" complete_cpuset="0x00000002" online_cpuset="0x00000002" allowed_cpuset="0x00000002">
                <object type="PU" os_level="-1" os_index="1" cpuset="0x00000002" complete_cpuset="0x00000002" online_cpuset="0x00000002" allowed_cpuset="0x00000002"/>
              </object>
            </object>
          </object>
        </object>
      </object>
    </object>
  </object>
</topology>
